text_raw,vader_pred,tb_pred,tr_pred,tr_top_emotion,real_y,vader_neg,vader_neu,vader_pos,vader_compound,tb_polarity,tb_subjectivity,sadness,joy,love,anger,fear,surprise
"Bengaluru to Heathrow. My first long haul flight with British Airways and I am not at all impressed. The service levels were disgusting. No ear plugs, No eye shades even after requests.  Drink service only a showpiece. Asked for a Virgin Mary and was give iced tomato juice with lemon. When asked for other ingredients like Worcestershire sauce, tabasco, Salt and Pepper, I was told that this was the airline recipe. My request for some salt and pepper to spice my drink was refused saying that `we do not stock them in Economy'. When I requested for a talk with the Head of Staff on the aircraft, he was sorry and said the airline was trying to cut corners and the crew pleas were falling on deaf years.  Only vegetarian dinner option provided since they had apparently run out. No menus etc. IFE selection with dated screens and headsets.  Was a Low cost carrier experience that takes a passenger from Point A to Point B without any feel good moments.",negative,neutral,positive,joy,negative,0.131,0.855,0.014,-0.9498,0.027083333333333324,0.6131944444444444,0.008097659,0.9485423564910889,0.010095139034092426,0.026456832885742188,0.001417113,0.005390848
"Heathrow to Bilbao. Boarding of the flight at Heathrow was very good , the flight was on time and the plane was clean. Frequent flyers boarded first and the rest soon followed. From then on the service was very similar to a Easy Jet or Eurowings flight. The 3 crew member's in economy passed through the cabin selling M&S sandwiches , snacks and coffee. The flight out of Bilbao was delayed by a late incoming aircraft, information on the delay was a little slow in coming from the gate agent. However the crew were very efficient loading the flight when it finally landed. The flight crew also managed to shave 15 minutes off the flight time too. However the service onboard is similar to Eurowings. Both flights were safe and competent. But the actual flight experience was lacking and in future I will consider Easyjet or similar as they offer the same level of service for less money.",positive,positive,positive,joy,neutral,0.019,0.911,0.07,0.7538,0.12135964912280703,0.45526315789473687,0.22470661997795105,0.5766904950141907,0.002708622,0.13666050136089325,0.056697544,0.002536241
"BA362 6th June 2015. If this were the first flight I had taken with British Airways I would not be impressed. At check in there is a lack of professionalism. The customer does not come first even at the First Class check in. Staff interrupt each other and discuss their own business in priority to completing the check in. The flight was in fact delayed by an hour despite the information such as was provided given as ""ten minutes"". The aircraft appeared dated and not especially clean with crumbs on the seat and grease marks on the windows. The inflight shopping was made difficult as there were no inflight duty free magazines available in Club Class. Inflight entertainment system did not work. Whilst the food was good it had to be changed as the first offering was cold. Inflight crew were pleasant and efficient. Upon arrival the baggage reclaim took no account of priority passengers.",negative,positive,neutral,surprise,negative,0.105,0.809,0.086,-0.11,0.20686274509803917,0.5485294117647059,0.006050763,0.054867923,0.003120126,0.022909104824066162,0.019350368529558182,0.8937017321586609
Hong Kong to London. Great airline indeed! Staff were friendly and helpful! The aircraft was very clean. The crews are diverse. Will definitely fly again.,positive,positive,positive,joy,positive,0,0.55,0.45,0.9467,0.6863541666666667,0.765,0.000169488,0.9983057975769043,0.00101795,0.000204368,0.000107427,0.000194887
"I have used Ryanair for European destinations and have always been very happy, but while searching I found Iberia/British Airways offering return to Barcelona for £75 including 23kg of baggage. The aircraft was an A319, I am 6'3"" so seat was bit cramped, but no more than other budget carriers, aircraft was spotless, crew very attentive. There was complimentary food and drink. Outward flight on time, inward flight was delayed by about one hour by problems earlier at Gatwick. I will certainly use again but other budget airlines better wake up!",positive,positive,positive,joy,positive,0.082,0.79,0.128,0.7085,0.21592857142857141,0.5321428571428571,0.001050206,0.9946054816246033,0.000717465,0.002773816,0.000572732,0.000280349
"We have had some torrid experiences with BA - which we have not been shy to report. So when we flew yesterday with them from Heathrow to Austin and had a great flight in every way, it felt right to feedback on that. The staff in the upstairs business class cabin were, frankly, wonderful. Cheerful, efficient and calm. What more could you ask? The food was pretty nice and the champagne lovely. The beds were very comfortable and sleeping was easy. I literally cannot think of any real negatives. The luggage lockers were quite small but then it’s an older model of the plane so that probably explains it. If only BA could deliver this kind of experience on every occasion, they would once again be the “world’s favourite airline’. Sadly, the current CEO doesn’t seem able to inspire and motivate his staff to be consistently delightful. Perhaps once he moves on we can expect something better. Although the flight was a bit delayed on departure it arrives bang on time. As we entered the (literally empty) immigration area, we were met by the most charming customs officer you can imagine, who ended up giving us tourist tips and ideas for bars! Surreal, as anyone who regularly travels to the States, will testify! It felt as if we were living in the Truman Show at one point but in the nicest possible way. Get yourselves down to good ole Austin now that BA fly there direct. Fantastic.",positive,positive,positive,joy,positive,0.028,0.758,0.214,0.9944,0.32348965848965855,0.7043391793391793,0.000519683,0.992811382,0.003773291,0.000444198,0.000286106,0.002165334
"Munich to London-Heathrow with British Airways. While British Airways is more or less in the same price range as Lufthansa, no complimentary food or drinks were served. Crew was friendly. The departure was from Terminal 1 in Munich, which is by far not as nice as the newer terminal 2. And arrival at Terminal 5 in Heathrow which is not as nice/easy as the new Star alliance Queens Terminal 2. No WiFi, personal device entertainment or onboard monitors on my flight. Seat reservation too expensive in my eyes. British airways has one big advantage though: the generous hand luggage rules.",positive,positive,positive,joy,positive,0.061,0.811,0.128,0.8206,0.063906926,0.37472943722943713,0.000749937,0.9869944453239441,0.009934229,0.001726923,0.000304901,0.000289548
"I was traveling with my wife in business class from Seattle to Bangalore via connecting flight in London and we reserved our seats together while booking the tickets. But mysteriously they changed it later and when we got our boarding pass, they assigned 11h and 5d. Called several times but they couldn't do anything and gave us explanations like may be some one else needed those seats and there are no other seats together available. When we boarded, the whole plane was empty and still they didn't allow us to seat together. ",negative,positive,negative,fear,negative,0.071,0.896,0.033,-0.4116,0.080357143,0.3821428571428571,0.055732470005750656,0.012778186239302158,0.001401254,0.42838266491889954,0.4992944896221161,0.002410896
"Straightforward and friendly baggage drop. On to South Lounge, no polite conversation on have you used our lounge before, no indication that it was so busy there was nowhere to sit at all considering even the 1.5m distancing. Had to roam the entire lounge, lugging our bags on the carpeted floor, with no success at all. Gave up after 20 minutes and decided to try another lounge. Arrived and everything was actually right in front of us and actually found somewhere to sit after 5 minutes of looking around. Menu was basic with no eggs, hash browns or any breakfast cakes or muffins. Ordered a frittata as was so hungry. Made my way to the self-serve coffee counter which had basic coffee and was straight away put off by flies hovering over the croissants and fruit. Flight was departing from a gate where you had to take a train to and as if to rub salt in the wound were then told that DXB flight usually leaves from there and should’ve gone to the lounge near there. Looking at the individual cubicles which was to be honest our top reason for choosing business class gave me heart. However, the doors cannot close till take off. I asked for the artisan crisps or biscuits on the Menu and it took them over an hour. Lunch came in another almost hour. Asked if could swap puddings as am not a crumble person, said will surely try but clearly didn’t, with no apologies or even trying. Portions were small, plus saw quite a few fellow passengers sleeping through lunch so asked if could have more but all was finished. Chocolates are Lindor. Nothing special about the other amenities, toilets were no different to what you’d expect, amenity kit was basic, duvet seemed well used. It was not worth almost 4 times the amount of a regular ticket. Naive to trust claims of world class standards.",positive,positive,positive,joy,positive,0.062,0.877,0.061,0.1815,0.09510582,0.39467733912178354,0.001352284,0.9925974607467651,0.000842319,0.003792326,0.000790326,0.000625206
"The worst airline I have ever flown with. Allocated the very back row next to the toilets and galley. No chance of getting any sleep, question asked of possible seat movement ignored and getting bumped the entire time by cabin crew walking or pushing kart up and down aisle without one apology. Would have been better sitting in the luggage compartment.",negative,negative,negative,sadness,negative,0.136,0.821,0.043,-0.6584,-0.093650794,0.4876984126984127,0.9800575971603394,0.000819825,0.000286456,0.018176091834902763,0.000424735,0.000235374
"Check in well organised. No lounge in Cancun. Efficient boarding process. Given water bottle before take off, no welcome drink. Now COVID rules are being relaxed this needs to change. Menu good and food acceptable. Staff were experienced and well organised and gave a very slick on board experience. Managed to sleep a few hours. For the first time my tagged luggage was off quickly. This may reflect the fact that our flight was the only one into Gatwick at that time.",positive,positive,positive,joy,positive,0.05,0.787,0.164,0.8664,0.14479166666666668,0.6026041666666667,0.000522393,0.9977586269378662,0.000372031,0.000713107,0.000325781,0.000308105
"I would never fly British Airways on London-Istanbul-London route again. Business class seat is awful, same as economy seat, no space to work or even space for your legs, no entertainment, no TV. BA thinks they can get away with making so much profit and ripping you off. Definitely going for Turkish Airline in the future.",positive,negative,negative,sadness,negative,0.115,0.766,0.119,0.0604,-0.171428571,0.40714285714285714,0.5070821642875671,0.021507836878299713,0.001847102,0.46261879801750183,0.005188444,0.001755649
"Flew Oslo to Philadelphia via London. Was extremely disappointed with Business Class on British Airways. The flat beds were very narrow (and I'm only 4'11"" and weigh 100 lbs.) and therefore not very comfortable. The lunch served (beef entree) was inedible except for the tomato/mozzerella starter, the cheese and the dessert. (I had wanted shrimp salad but was told it was unavailable). Afternoon tea was better but certainly not stellar. The so-called warm scone was stone cold and the sandwiches were still very cold from being refrigerated. I had asked for both a diet Coke and an apple and the steward forgot both requests.",positive,negative,negative,anger,negative,0.037,0.88,0.083,0.7306,-0.144895105,0.5782167832167832,0.00692011,0.002056815,0.000567805,0.9882820248603821,0.001940513,0.000232764
"New Orleans to Hyderabad via London. I booked my flight ticket couple of moths before my travel and I received an email on the day I'm going to travel saying that my flight was cancelled and they asked me to book my ticket for the next day. This destructed all my plans. I have an interview to attend which is very important. I gave a call to the customer service and they really did not gave me any options. After couple of hours over the call, I am very frustrated and they gave an option to fly from MSY to DFW and London and Hyd and the layover is very short and I am very tense as I don't have any options to choose. This whole journey was very irritating and the customer service is really bad. ",negative,negative,negative,anger,negative,0.125,0.861,0.014,-0.9498,-0.064269972,0.5382920110192838,0.00065757,0.000382306,0.0001858,0.9974722266197205,0.001158385,0.000143649
"My husband and I flew on British Airways flight BA-228 from Baltimore to London Heathrow leaving on the 12th February 2019. Every aspect of the flight was poorer than what budget airlines have to offer. The plane was shabby and dated. The seat reclining facility did not operate properly, was not that comfortable, and we had less legroom than the equivalent with budget airlines. The touch screen TV monitor was not working properly. One ear bud on the headphones did not work. The audio socket was too loose for the headphones so the plug kept falling out making it difficult to enjoy the in-flight entertainment (which in itself had a dated choice). The pillow was disgusting and kept falling out of the flimsy cover. The air conditioning lacked consistency alternating between very hot and very cold air. The restroom occupied sign always lit up as vacant even if it was occupied. However what made the flight very unpleasant was the bad attitude of the cabin crew. They were abrupt, unfriendly and quite clearly did not want to be there. There was one exception, an extremely pleasant older crew member who greeted us on and off the flight. There did not appear to be any organisation or smooth co-ordination when distributing the meals. Our two trays of food where placed on top of each other and practically thrown at us by a sour faced crew member. This flight was one hour late making us nervous about catching our connecting flight. There was no information or instructions given to us about connecting flight gate numbers before we landed. Unlike all the other airlines that I have travelled with there were no staff member greeting the connecting customers to point them in the right direction or re-assure them. British Airways would be my last choice of an airline to travel with and I would only fly with them again if there was no other option.",negative,neutral,negative,anger,negative,0.101,0.845,0.054,-0.9158,-0.004012515,0.5471092796092797,0.2520672380924225,0.003182592,0.000889386,0.7265532612800598,0.016651696,0.000655793
"I booked Premium Economy from INV to LAX (via LHR). They notified me of a cancelled flight on my return journey and rebooked me on a flight that my connecting flight arrived too late for! Then they cancelled a flight on my journey to LAX! They then cancelled the rebooked flight on the return journey and rebooking me back on the first flight that they had rebooked me on - the flight that I have no chance of making as my return flight arrives too late into LHR. They re-routed me from LAX to JFK to LHR - which I would have accepted - but they booked the journey in Economy (LAX to JFK) which my husband (6'4"" with a knee injury) - cannot do and now they won't change it - even though they have a direct flight from LAX to LHR with Premium Economy and unacceptable flight allows us 54 mins to transfer flights at JFK - and my husband won't be able to walk slowly, let alone quickly, after enduring the 6-hour flight from LAX to LHR. I have chatted only to have my calls disconnected and I also have online chat which proves I did not accept this re-routed flight to JFK but they won't budge.",negative,neutral,negative,anger,negative,0.088,0.905,0.007,-0.9421,0.041458333,0.4458333333333333,0.035775531,0.067942984,0.003113632,0.8220819234848022,0.069781192,0.001304629
"First leg CAI-LHR was on time, flight crew was pleasant, but the seating was very cramped and legroom almost non-existent. The second leg LHR-JFK wasn't much different with helpful crew but horrible seating space. My knees were pressed against the seat in front of me constantly and had to relieve them one at a time. It used to be a flagship carrier but now it's not much better than a budget airline. Will do my best to avoid.",positive,positive,positive,joy,negative,0.11,0.72,0.17,0.7042,0.1037037037037037,0.48148148148148145,0.019505331,0.9730815291404724,0.001944503,0.003926908,0.000938218,0.000603471
"BA continue to charge a premium for the most disgusting service, provided by people who shouldn't be in customer service, on tired, dirty and cramped aircraft. Out of 11 flights this year, not one has managed to depart or arrive at their destinations on-time. Including having 3 business class tickets cancelled and an alternative in economy being offered, still no refunds 3 months on and had a flight late and missed connection, so BA cancelled the rest of my ticket, leaving me stranded in the US. ",negative,negative,negative,anger,negative,0.187,0.813,0,-0.9448,-0.36,0.72,0.08329881,0.001232365,0.000509552,0.9119446873664856,0.00249747,0.000517181
Flew British Airways from London Heathrow to Johannesburg. We enjoyed the flight very much on the A380. We chose two seats together and it was comfortable. The inflight entertainment was good and had a fair choice. The food was ok and there were plenty of drinks to go round. Staff were professional and helpful.,positive,positive,positive,joy,positive,0,0.706,0.294,0.9559,0.3288888888888889,0.47333333333333333,0.000236384,0.9983440637588501,0.0009418,0.000207009,0.000109052,0.00016168
"I flew London to Cairo and return in October 2023. It was basically a perfectly good pair of flights in Economy, with pleasant and professional cabin crew (especially on the return journey). Being only 1.73 m tall I have no problem with legroom in the back of the plane, the seat was OK if getting a little numbing after 5 hours, and the return of a rather good included snack box and drinks was welcome. However, it must be said that the value for money was poor: with a checked bag on the return leg only, this was a nearly £700 ticket. And although I am content to pass the time by reading or sleeping, it was surprising to find no in-flight entertainment on 5-hour flights. However, overall I would still recommend BA and would do so even more enthusiastically if it was more sensibly priced.",positive,positive,positive,joy,positive,0.055,0.757,0.189,0.9726,0.2791666666666667,0.5686274509803922,0.00104305,0.9977593421936035,0.000399855,0.00039979,0.000199746,0.000198125
LHR-FRA-LHR in spotlessly clean airbuses both looked brand new (although they weren't). Crews were immensely friendly and helpful with a smile for everybody. Slight delay on the return leg but kept well informed. Only minus point is the remote stands at FRA that slow boarding and disembarkation to a snails pace.,positive,positive,positive,joy,positive,0.027,0.809,0.164,0.6855,0.056818182,0.4023569023569024,0.000176859,0.998618484,0.000769818,0.000179308,0.000104809,0.000150722
"The flight was delayed over 6 hours and this of course caused us to missed our connection flight and change to a different route, finally I lost my luggage and no one has any information. I will never again travel with British Airways.",negative,neutral,negative,sadness,negative,0.181,0.819,0,-0.765,0,0.5333333333333333,0.9976707100868225,0.000304791,0.000121457,0.001077498,0.000696231,0.000129362
"You can buy sandwiches and crisps but don't expect a hot meal. Because the plane is a narrow body , there are no screens. Not helping matters is the fact that the BA prebooking shop for food didn't recognise the flight number, and the onboard  WiFi didn't work. ",negative,neutral,positive,joy,negative,0.121,0.851,0.028,-0.5849,0.024999999999999994,0.625,0.030117532,0.5724664330482483,0.03880547,0.3477950990200043,0.009408794,0.001406609
"London Heathrow - Vancouver - London Heathrow. First impressions could have been better as this flight departs from Terminal 3, rather than terminal 5 at Heathrow. The departure lounge was being used by multiple longhaul flights on large aircraft meaning that the area as crammed full with most passengers having to stand and making it difficult to access the departure gates. However the ground staff did their best to manage the situation and were clearly used to having to manage it. Once on board I found the cabin to be very clean. Unlike many airlines, BA offers economy seating upstairs on the A380 where the ride is noticably smoother and quieter than on most other aircraft. However the profile of the cabin means that the overhead lockers are smaller than usual, which could be an issue for those with roller cases. The IFE system provided is excellent. I also ordered one of BA's new gourmet meal offerings rather than take the standard meal. This option was well worth taking up, offering an improved choice and quality. The service provided by the flight attendants was friendly and professional and this is one area where British Airways seems to do consistently well. If I have a criticism it is that the 31 inch seat pitch seems miserly for a 9-10 hour flight. Arrival at Vancouver was on time and I was through immigration and landside in about 20 minutes. Processing through security for departure from YVR was equally efficient. The return flight offered a similar experience to the outward one, although arrival in London was an hour late. However the relatively quiet cabin on the A380 meant that I was able to get some sleep. Unfortunately the arrival experience at LHR terminal 3 was no better than the departure one. A lengthy walk to arrivals concluded with having to join a slow-moving, snaking line to clear immigration. A marked contrast to the experience at YVR.",positive,positive,positive,joy,positive,0.035,0.85,0.114,0.9781,0.164464122,0.4280742489833399,0.002239326,0.9920503497123718,0.000755675,0.003563578,0.000985238,0.000405833
A short haul from Gatwick to Rome and I had no expectations. Check in was quick and we were on a vintage Boeing 737. All in all very happy. They supplied a decent enough snack. Drinks service was efficient. There was no in- flight entertainment available but we should all be able to cope for 2 hours without surely? Comfortable enough friendly service got there on time and good price. All adds up to a happy traveller.,positive,positive,positive,joy,positive,0.102,0.695,0.202,0.8918,0.38958333333333334,0.6159722222222223,0.000284907,0.9988996982574463,0.000325026,0.000197415,0.000120165,0.000172803
"Our first time flying to Dominican Republic and found the best deal with British Airways and the benefit was it is a direct flight from Gatwick to Punta Cana. On the outbound flight, the plane was half empty, so it was nice and spacious. The BA Boeing 777 is an outdated plane which has been used in their fleet for many years and has not had a refurb I would say in about 10+ years - I suppose this is why the flight was so cheap. The staff on board were friendly and efficient. The seat pitch is large so I could sit for 9+ hours comfortably, the seats despite the plane being old, were comfortable and not showing signs of wear. The entertainment system is what shows the age of the plane, one of the smallest screens in the industry. They are very small, and the anti-glare screen is hard to see from you need to keep adjusting the brightness of the screen throughout the movie. The range of movies was good. Food was ok nothing special and not really a choice.",positive,positive,positive,joy,positive,0.026,0.815,0.159,0.9807,0.21490929705215417,0.4854761904761904,0.000643696,0.9978443384170532,0.000582001,0.000558461,0.000194438,0.000177015
