text_raw,vader_neg,vader_neu,vader_pos,vader_compound,vader_pred,tb_polarity,tb_subjectivity,tb_pred,sadness,joy,love,anger,fear,surprise,tr_top_emotion,tr_pred
London Heathrow to Stuttgart. Absolutely disgusted with BA. my husband was asked to put his one piece of hand luggage in the hold due to the flight being busy and he agreed. BA had one job to do - put it in the hold and make sure it arrives in Stuttgart. This has proven too difficult. The bag is lost and they have not offered any assistance or support.,0.105,0.767,0.127,0.204,positive,-0.205,0.7127777777777778,negative,0.0005557611002586782,0.0002789367572404444,0.0001841088815126568,0.9981544613838196,0.0006767251179553568,0.00015002602594904602,anger,negative
"London to New York JFK with British Airways, and abyssal customer service. Onboard the flight can be great, and it's the website and shoddy call centre staff who let them down. However, this time the onboard service was as bad as the ground service. Food was poor. I was in the upper deck with only 5 other business class passengers, and yet my food choice was gone. The TV's didn't work in 2 seats - I couldn't be bothered to try a third and decided to just get some sleep. The staff insisted on forming a cliquish huddle and were speaking so loudly I couldn't even sleep with ear plugs in.",0.055,0.894,0.051,-0.1376,negative,-0.053682659932659915,0.4529250841750842,negative,0.11133136600255966,0.0028393156826496124,0.0005903848214074969,0.8831765651702881,0.001539111020974815,0.00052324851276353,anger,negative
London to Manchester. British Airways is probably the worst air company I have ever flown with they took 2 hours to unload the luggage and the flight was delayed by an hour. The staff were no help and frankly rude.,0.238,0.762,0.0,-0.8822,negative,-0.43333333333333335,0.5333333333333333,negative,0.0006381474668160081,0.0002608240465633571,0.000179143127752468,0.9979265928268433,0.0008286513038910925,0.00016660087567288429,anger,negative
Domestic Edinburgh-Gatwick. Late by 40 mins but that's not unusual. Flight itself lovely clean quiet made up some time. Crew smart and friendly. Only down side was coming off a bridge to a closed gate to then being herded onto a packed bus. Bags came fairly quickly sometimes at LGW it can be a while!,0.0,0.751,0.249,0.9577,positive,0.10142195767195768,0.5429232804232804,positive,0.00030167464865371585,0.9927571415901184,0.006190331187099218,0.00037181517109274864,0.00016621730173937976,0.0002128404303221032,joy,positive
"London Heathrow to Sofia. We checked in online, so we went straight to baggage drop. It was quick and worked well, our bag was 25 kg, maximum is 23 kg, so we had to take 2 kg out. After that, we went to buy a neck cushion and we went to put our make up in bags, show our passport and then go through to security. My daughter was beeped, but it wasn't a big deal. It was fast, and our flight was departing in 1h 30m. We got some drinks, and then we noticed our gate was announced early. We headed to the gate and boarding began about 20m later. Boarding was fast, and we were sitting in seats 33 DEF. The seats were comfortable, leather and had headrests. A321 so there was no IFE. We had a 1 hour delay from the bad airspace, but eventually took off. Our route was a little different, instead of going over France, Switzerland, etc, we went over Germany, Hungary, etc. The food was good and wasn't too expensive. We didn't buy anything really, just food. While coming into Bulgaria, the views were nice. The landing was pretty good, despite the bump. Eventually we got off 1 hour late, and we went home. The verdict is that British Airways are pretty good, despite the delay.",0.048,0.806,0.146,0.9751,positive,0.14980158730158732,0.5412698412698412,positive,0.001341340015642345,0.9931457042694092,0.0006480684969574213,0.003246674779802561,0.0010198261588811874,0.0005984004819765687,joy,positive
"I sat in seat 25C. Our Cabin Crew lady was called Gina and she went above and beyond to keep the customers happy. She greeted us as we boarded with a very cheery smile, she engaged with two families travelling with young children and gave out games and books. Her trolley service was excellent and she took great care in what she was doing. She had time for a quick chat and I think she said she was half German and half Bulgarian, a really lovely young lady who is a credit to British Airways.",0.0,0.721,0.279,0.986,positive,0.3221428571428571,0.45238095238095244,positive,0.000932658149395138,0.9026466012001038,0.0947110578417778,0.0006449032225646079,0.00028472772100940347,0.0007800881867296994,joy,positive
"I had an Incredible rude check in staff at the British Airways counter in Nice on 16th April 2022. Zero empathy towards me a struggling customer. Second situation happened when we arrived into Nice Terminal 1 on BA0262 13 April where my luggage did not make it on the same flight as me and had to put my details down for delivery. When our luggage arrived at Nice airport the day after and received an email from the AVIA Partner lost and found (British Airways Partner) at 13:14PM informing us that our luggage has now arrived in Nice. After multiple emails back and forth with emphasis on we were strongly expressing that I did not have clothes or shoes to wear and that we only had 3 short days in Monaco, it was vital we received the luggage ASAP, the lady replied “If it is so important why don’t you come and pick it up here at the airport or send your driver to pick it up” despite the fact that a proper delivery address was supplied to them from the very beginning. This has been an appalling experience.",0.053,0.861,0.086,0.7161,positive,0.1727513227513228,0.507010582010582,positive,0.8378788828849792,0.07273638993501663,0.0014253362314775586,0.05824153497815132,0.027790788561105728,0.0019269908079877496,sadness,negative
"For a long time I have avoided taking British Airways due to it’s poor past reputation. Yesterday I traveled on BA 34 from Kuala Lumpur to London Heathrow, I boarded the flight with an open mind, over 12 hours later I disembarked feeling very happy because it is always good to see an airline make visible improvements that deliver value to it’s customers. A praise is due and I want to congratulate BA for such a pleasant experience, the flight departed on time and arrived half an hour early, the crew was not only professional but they did everything with a smile that made passengers feel welcomed, the plane was pristine new with delightful entertainment content, the food was way above the expectations of a seasoned economy class traveler. What more can I say? Enough to say that I will be traveling with BA again!",0.023,0.783,0.194,0.9765,positive,0.16100131752305666,0.436429512516469,positive,0.00017515284707769752,0.9990842342376709,0.0003517309087328613,0.00010028605174738914,0.00010501722135813907,0.0001835218572523445,joy,positive
"FRA-LHR on A319, We sat on the plane at the gate for almost 40 minutes due to one runway closed, no drinks offered. No veg meal for my wife, Empty bottle under the middle seat tray. Landed allegedly almost on time due to the excessive time scheduled for the leg.",0.117,0.883,0.0,-0.6369,negative,-0.1142857142857143,0.35000000000000003,negative,0.052773281931877136,0.0033750925213098526,0.0006058777798898518,0.8029605150222778,0.1393641084432602,0.0009211686556227505,anger,negative
British Airways are not interested in providing normal business class comforts and cuisine or even lounges on some routes. The Cancun route and the Nassau routes I have flown recently show this clearly as they are presumably are not bothered with little or no competition at all. This saddens me that they have made a clear decision that on holiday type routes they will provide the absolute minimum on everything. One example that shows how pathetic it has become with cutbacks out of many problems I encountered on these routes is that the food was so awful on the Cancun flight recently that we merely asked for cheese and biscuits in business class to be told that we could only have one packet of two biscuits each as BA only allocated one packet per person. The staff all agree that this was pathetic! No lounges at both these airports either and queuing of business class and economy all together no attempt to really show you paid extra for your ticket.,0.133,0.786,0.081,-0.8814,negative,-0.1423611111111111,0.562037037037037,negative,0.996661901473999,0.00031873045372776687,0.00020701100584119558,0.0024629654362797737,0.00016253997455351055,0.00018695947073865682,sadness,negative
"Second time getting poor service from BA. 1st, unable to contact via phone, email or website. 2nd even with four business class tickets across the Atlantic, they do not allow free seat selection or check in until 24 hours prior to the flight. Do they understand what the last 24 hours of an international trip are like? By the time we confirmed our seats my wife and our kids were spread throughout the plane. Of course no-one at the airport could do anything. ",0.084,0.888,0.028,-0.6083,negative,-0.011111111111111108,0.32962962962962966,neutral,0.003213181858882308,0.9448990821838379,0.0014283988857641816,0.012842956930398941,0.036043014377355576,0.0015733455074951053,joy,positive
Flew YVR to MUC via LHR. I had high expectations for this airline but was pretty disappointed. We were flying with twin 15 month olds so it's great with BA that you can preselect the bassinet spots when booking. Crew did bare minimum seemed as though asking for anything was a huge inconvenience. Audio on IFE was awful couldn't hear any movies. Flight landed 10 minutes late in London and we were denied boarding on the MUC flight due to being late. If they allow a connection of 1h10 and you're 10 minutes late and can't get on their system is flawed. When are any LHR flights not 10 mins late! They rebooked us 2.5 hours later but after complaining put us on a Lufthansa flight 1 hour later. I never thought I would say this but will use Air Canada on this route from now on if the price is equal.,0.122,0.791,0.087,-0.7371,negative,-0.124375,0.5353125,negative,0.7590532302856445,0.004871728830039501,0.000670052133500576,0.20770078897476196,0.026832852512598038,0.0008712681010365486,sadness,negative
"The customer service of British Airways is really bad. You can't reach any call centre agent even after waiting for 30 mins. Now, I really appreciate Emirates and Turkish Airlines after facing BA's low quality customer service. Not only the customer service but the food they offer during a long haul (LDN-JNB) is really low quality. Other airline operators which are working with Do&Co for flight catering are way better than BA. I guess BA has selected the lowest budget option from Do&Co. Overall my rating is 2/5 for BA - you can feel how stingy BA is when you fly with them. Note: Respect to their cabin crew",0.119,0.801,0.08,-0.436,negative,0.05681818181818184,0.42196969696969694,positive,0.0017783096991479397,0.0015001519350335002,0.0008150237263180315,0.9943515062332153,0.001225910848006606,0.00032904266845434904,anger,negative
"I am happy to say that this flight was quite good. Except for the second rate Euro business seating, everything was very well done. A friendly, informative cabin crew served a good hot breakfast while being very communicative to folks nervous about Heathrow transit. Well done. Unfortunately, a bus gate was used upon arrival.",0.066,0.677,0.257,0.9183,positive,0.3027777777777778,0.5722222222222223,positive,0.0006300168461166322,0.9947816729545593,0.0005533386138267815,0.0016070607816800475,0.0021577326115220785,0.0002701616904232651,joy,positive
"San Diego to Hannover via London. I booked on ba.com, the longer flights both ways in premium economy.  On the return I was informed at San Diego that the American Airlines flight into DFW was severely delayed and I would miss my flight into London. American Airlines could book me on a later flight the same day, but had only  coach available. If I insisted on premier economy I could fly in 3 days. I took the coach and American assured my that BA would refund the fare difference for this downgrade. After arrival at home I contacted BA on their website to refund the fare difference. A bizarre exchange followed. First they said you did not buy any upgraded seat. I told them to look at the ticket. You can't get a refund because the economy class seat was much more expensive that the booked premium economy seat. I contacted BA Germany who said you get a refund, but you booked this with a travel agent, so we are not in charge.  I booked with BA on their website. They saidthey would send this to London so they can compute the refund, but then you can't get a refund because your seat was much more expensive than the premium seat you booked months in advance. The change in booking was the sole fault of the delayed American Airlines flight. This is miserable customer service.",0.072,0.915,0.013,-0.9127,negative,0.05,0.41225490196078435,neutral,0.7707294821739197,0.007058433257043362,0.0009469936485402286,0.12084890156984329,0.09899019449949265,0.0014259780291467905,sadness,negative
"Check-in very slow. No app check-in and could not check my vaccine QR code online. Check in staff friendly but too few of them. BA Silver card holder and no Stockholm lounge  to use. Boarding fine, but plane was worn out. Seats close together and row 30 even worse.  Crew really professional and happy it seemed. Arrival at Heathrow a total shambles. BA777 landed at 12.50, no gate so waited and waited for 25 minutes. Then BA jetty didn’t work. Then BA had no steps. Very slow to leave plane as only moderately mobile wheelchair passengers struggle down the steps. Everyone was very patient and supportive but it was terrible to watch. So BA skimping on lounge, plane condition and gate. Crew good, seats very uncomfortable.",0.189,0.705,0.107,-0.8986,negative,-0.005522875816993472,0.6164052287581698,neutral,0.0024894014932215214,0.9780503511428833,0.014308612793684006,0.003926024306565523,0.0009117365698330104,0.0003138206957373768,joy,positive
BA2204/5 LGW-PUJ-LGW B777-200ER. Both flights excellent comfortable seats tasty meals both ways and friendly cabin crew. Lucky to get upgrade to WTP on return flight very nice BA at its best.,0.0,0.552,0.448,0.9652,positive,0.6480555555555556,0.7388888888888888,positive,0.00032994308276101947,0.9927486777305603,0.006209074053913355,0.00026687924400903285,0.00012684919056482613,0.00031854870030656457,joy,positive
"Copenhagen to Amsterdam via London Heathrow with British Airways. There was problems at check in and a lot of people had to run to make the flight. But the attitude and welcoming hospitality of the crew made me forget that and I enjoyed the flight. The seats were nice and comfortable and the aircraft fresh. During the second flight from LHR to AMS, the expectations from the first flight were fulfilled and we had a captain that knew most of the passengers were frequent fliers and made jokes only frequent fliers would understand. Like how the taxi from Polderban is almost as long as the flight itself.",0.032,0.746,0.222,0.9791,positive,0.225,0.48611111111111116,positive,0.0009591075358912349,0.8191095590591431,0.177805557847023,0.0009989580139517784,0.0003651465231087059,0.0007616907241754234,joy,positive
"Club class on British Airways between Cape Town and London. Boeing 747-400 has the flat bed and while the quality of the cabin was inferior to the A380 between London and Johannesburg, it remains one of the better business class product. Check in at the BA counters in Cape Town would have been a breeze, was it not for the unexpected six hour delay in the departure of the flight. The upgrade from Premium to Club class made this inconvenience almost bearable. However,  Cape Town airport becomes like a ghost town when all flights but yours have departed. BA's Executive lounge in Cape Town is spacious and serves good food and Cape wines. There are free internet and computers and a friendly service, even at midnight. While comfortable, BA's Club seats on the 747 can do with an upgrade. They are configured in a 2-4-2 layout, with one passenger facing forward and the one adjacent facing backward, at the side row - the middle row has two forward and two backward facing. This is something I never understood - why facing backward because it just makes no sense. The seats are separated by a hard plastic cseparator that moves up and down with the push of a button. Theoretically, the air hostess should walk behind the front-facing seat to serve the backward-facing passenger at the window - however, on my flight the air hostess insisted on leaning over me, pushing the button to lower the separator and serving the accross my seat - after about three times this really got annoying. The problem is that if you don't raise the separator, you and your fellow passengers stare straight at each other from a distance of less than one meter. Food was satisfactory, rather than outstanding. . The starter choices were poached Norwegian Salmon with marinated prawns or an oyster mushroom salad. Main courses included Ballotine of chicken with Port, Drakensberg trout, pasta or a cold main course salad of za'atar beef medallion. I chose the chicken and it was OK, but inferior to my mother's Sunday roast chicken. There was a selection of South African Chardonnay, Sauvignon Blanc and some good reds. Breakfast was a choice of a cheese omelette, continental or a traditional English breakfast with bacon, sausages, mushrooms and potatoes. Arriving in London, I took the supposedly fast track option - a big mistake. In theory this is supposed to expedite your progress through customs as a Club passenger, but in practice it was a disaster - there were only two or three border agents present at any time and it took 45 to 60 minutes to get through the fast track immigration - I could see group after group of fellow BA passengers clearing the slow lane long before I took the next few steps forward. BA arrivals lounge was a welcome relief from the hustle and bustle of Heathrow Terminal 5. All in all, not a bad experience, but having flown on these seats quite a few times over the past 15 or more years, I really think it is time to either upgrade the Club cabin on the 747's.",0.058,0.854,0.088,0.9691,positive,0.03900966183574879,0.45555555555555555,neutral,0.02723747305572033,0.827235758304596,0.002077506622299552,0.07932540774345398,0.05826188996434212,0.005861927755177021,joy,positive
Covid form is broken - Called customer service twice on different times and they hung up due to being too busy to pick up the phone. 1 hour flight delay - was first in the queue and had to hand in my hand luggage due to there being not enough room which was untrue as most storage compartments where empty when I entered the plane. I explained that I really cannot afford to wait on my luggage as I have 3 hours drive left after I arrive at the airport. In short: totally not customer friendly. Will try to avoid flying next time with BA.,0.105,0.84,0.055,-0.5983,negative,0.045,0.37555555555555553,neutral,0.3517066240310669,0.2970612645149231,0.0030176907312124968,0.32363834977149963,0.022691134363412857,0.0018850037595257163,sadness,negative
"Flying in Club Europe from London City to Berlin Tegel, returning in economy with British Airways. The outbound flight was delayed for nearly 1 hour. However, the journey itself was very smooth and enjoyable. The food offered in the CE cabin was delicious. Flying back in economy was an absolute nightmare. Everything went wrong from checking in, lounge access, baggage claim and extremely poor service relating to my missing luggage. I had done my online check in on my return flight. Just went to the check in counter to drop off my luggage. The check in agent offered me a paper boarding pass which later I discovered had been incorrectly issued to me. She checked me in under someone else who happens to have the same last name as mine. After I dropped off my luggage, I went to the business lounge as I am a silver member. I provided the recepitionist my paper boarding pass and entrance was declined. Not surprising given the fact that they gave me the wrong boarding pass. However, I showed the receptionist my silver status on my mobile app. She didn't even look at it and told me my membership had been downgraded on her system. she didn't investigate anything and asked me to call up BA which I didn't bother. When I was queuing up at the passport control, I noticed the destination shown on my boarding pass was incorrect. I approached the BA staff at the gate immediately after I had cleared through security. BA staff were shocked that I was checked in under someone else's name. Wrong name, Wrong flight etc. They asked me to go to the correct gate immediately, but then they also told me my checked luggage was on the wrong flight and I might not have it back upon arrival at LCY. They gave me a new luggage tag. After arriving at LCY, waited for 20mins, bag didn't show up. I approached the baggage claim agent who was on her phone. I explained the situation which she didn't really pay attention and asked me to stand next to the conveyor belt, insisting my luggage would arrive. Again, no investigation, rushed service and a bit rude. 3 days later - no luggage still despite the fact that they have located my luggage. ",0.078,0.896,0.026,-0.9595,negative,-0.07174545454545454,0.45784848484848484,negative,0.42408326268196106,0.12531618773937225,0.0033173745032399893,0.19306747615337372,0.2411542683839798,0.013061469420790672,sadness,negative
"Gatwick to Amsterdam in Business class was truly the most uncomfortable flight of my life. I thought that with British Airways I might expect something a little better - what a stupid mistake. The Business class seats are standard economy class, with middle seat empty. Food for breakfast was okay although not enough if you were hungry. But luckily they provide champagne during the flight.",0.096,0.74,0.165,0.7357,positive,0.020486111111111118,0.4861111111111111,neutral,0.0063414922915399075,0.0017470474122092128,0.0002581183216534555,0.006686293985694647,0.9839897155761719,0.0009773964993655682,fear,negative
"Athens to London with British Airways. To call this business class is some sort of mean spirited joke. To start with British Airways lounge is provided by Skyways which as jammed with both people and a bad assortment of food. The actual seat (3D) had no power plugs and no TV at the front of the seat, what you find in economy in Canada. The seat width was narrow and the pitch was pathetic. Flying premium economy on Cathay Pacific is dramatically superior. The flight from Heathrow to Athens was on a very beat up B767 on Aug 4/ 2017. The food on this flight was both minuscule and horrid. It is amazing that they can attempt to call this level of service ""business"". Very disappointing.",0.127,0.794,0.079,-0.7956,negative,-0.08403846153846152,0.5741666666666667,negative,0.7948418259620667,0.01037509273737669,0.001374714425764978,0.1882585734128952,0.002764299279078841,0.0023854966275393963,sadness,negative
"Leeds Bradford to Heathrow. Service is equal to Ryanair and EasyJet. I've been flying with BA regularly for last 4 years and I can't get my head around what is going on. Complimentary drinks replaced with a Buy on Board menu and the flight is so short not all passengers even get served now!  Really just appalling. There is no competition on the LBA route, but I certainly won't pay anything extra to travel with BA from now on if there are alternatives available - Ryanair it is at around a fifth of the price usually!",0.034,0.896,0.07,0.5557,positive,0.04107142857142858,0.3286380286380286,neutral,0.001830713008530438,0.9893429279327393,0.0012278348440304399,0.006188973784446716,0.00044876066385768354,0.0009607983520254493,joy,positive
"Just arrived back in UK on British Airways after a stay in Las Vegas. On outbound flight, the chicken dinner ran out at the next row to me, alternative was Spinach pasta! I declined. On return journey earlier today, the breakfast consisting of bacon and  sausage ran out one row from us! Had to endure veggie option of hash brown, tomato, mushrooms. For some reason they serve from front and rear, and by the time they meet around the low 40 rows, you don`t get a choice! Surely in the days of computers checking everything, they would know the ratio of meals that passengers are choosing. TV screens did not work for entire flight, steward even advised London were re-setting it remotely from ground!",0.016,0.952,0.032,0.453,positive,-0.024999999999999998,0.3848765432098766,neutral,0.03794398158788681,0.008352058939635754,0.0008516922243870795,0.9120426177978516,0.04019860923290253,0.0006110502290539443,anger,negative
"The best thing about this flight from London Heathrow to Miami was it’s punctuality. However having got up at 5am for the flight time at 10.45, if we hadn’t eaten breakfast in the airport we would have been starving by the lunch service, which was served what seemed like a long time after take off. 6 hours after the mediocre lunch were were served an even more mediocre sandwich. Only one cabin staff for premium economy service meant drinks and meals were served very slowly by the hard worked lady. Aircraft an elderly 747 and showing its age. Screen tiny, scratched and hardly worth looking at. We have flown similar routes on Thomas Cook and TUI planes and the service and comfort of their new aircraft was miles ahead of this BA flight, which I think is shameful for the national carrier.",0.048,0.881,0.071,0.5279,positive,0.017058080808080796,0.5596843434343435,neutral,0.9616320729255676,0.0013691203203052282,0.000806106545496732,0.0350460484623909,0.0005582131561823189,0.0005884378915652633,sadness,negative
