text_raw,vader_neg,vader_neu,vader_pos,vader_compound,vader_pred,tb_polarity,tb_subjectivity,tb_pred,sadness,joy,love,anger,fear,surprise,tr_top_emotion,tr_pred
LIS-LHR-VIE on Dec. 8 both legs on an Airbus 320 in Club Europe (Business Class) - both legs on time seats were Economy seats with the middle seat left unsold and featuring the new slim seats which are less comfortable and have a reduced seat pitch – Check-in in LIS was handled by rather surly agents which was untypical for an otherwise friendly airport but Business class waiting lines were very short so overall it was OK. LIS-LHR leg was with a rather lacklustre and inattentive European fleet crew after the initial service of food and drinks further service consisted of clearing the dishes and on board sales. Other than that Business class flight attendants were behind the curtain reading magazines chatting and rather attending to themselves than the passengers. At 11 am the Business Class food served was a plate cold cuts a roll and three thin slices of fruit (basically a make yourself sandwich on a plate). Extremely disappointing and poor for a lunch flight scheduled to arrive in Heathrow after 1 pm. On the LHR-VIE leg service was“afternoon tea”meaning again sandwiches. However this time at least it was more appropriate due to time of day. Full bar service on both flights and the French white wine served was ok. The mixed fleet crew on the second leg was more interested in its job and up to BA standards regarding friendliness and attentiveness. Transfer procedures in LHR Terminal 3 were fast and friendly even the extra security checks required for all transfers at LHR (even Intra-EU) were hassle free and easy. BA’s Galleries Lounge in LHR T3 was again an oasis of rest amid a busy airport; comfortable with excellent drink selection and decent food selection including several good warm choices such as various curries. In Lisbon Portela BA uses the shared Blue Lounge which is small and offerings are rather limited; some limited snacks ok drinks but at least good Nespresso coffee. Although small it was not crowded which is a plus. So BA delivered a good basic product for economy standards but I fail to see any real Business Class service offered here (not seat wise not meal wise not service wise). The only saving grace was the Galleries Lounge in Heathrow T3 and the better service on the LHR-VIE leg. Not recommended for Business Class within Europe based on this experience. (Oneworld Sapphire).,0.071,0.79,0.138,0.9864,positive,0.1397842594563906,0.4511791214250231,positive,0.005328192375600338,0.9869084358215332,0.002127622254192829,0.00424564816057682,0.0010050731943920255,0.00038492053863592446,joy,positive
"I was horrified by the extremely small seats and the poor training that the crew clearly receives. Not one of them exuded any kind of warmth or expressed any desire to make our journey pleasant. The seats were so narrow that regardless of the size of your neighbors you are forced to touch each other constantly, if the seat in front of you is reclined you have no choice but to recline your own, or else you are breathing in the head/ scalp of the person in front of you. Food was revolting, they don't even provide napkins unless you ask with the pre-meal drinks and the secondary meal. The last time I flew BA it was a completely other experience and I was so sorry to see how far the quality level has slid. It was really majorly disappointing and I regret that I have already purchased 2 other intercontinental trips with the company. I will now have to see if I can change them. The pathetic 250 ml bottle of water, it's just a sip. On the shorter flights the seats couldn't even be reclined which was a great pity since the flight was delayed by almost 3 hours and we had to wait on board.",0.123,0.82,0.057,-0.9405,negative,-0.05458333333333334,0.5662499999999999,negative,0.971387505531311,0.008392675779759884,0.0006063469918444753,0.018517600372433662,0.0007160656386986375,0.00037978545879013836,sadness,negative
"The booking of our flights was straightforward. However, when we have paid to sit next to each other, and paid for the opportunity to book seats in advance, you would expect the seating plan for the aircraft to clearly show where all the toilets and galleys are so that as the paying customer we would have a choice as to whether to is near them particularly on a long haul flight, on this occasion British Airways failed miserably. The plane was new and the seats were comfortable and spacious enough, not the upper deck in ecconomy. However being seated next to the toilets was not the best location, particularly as we had pre booked the seats online. The service was excellent and the staff helpful and happy to be there. The gluten free meals that we ordered were provided although the breakfast could have been more substantial especially after an 11 hour flight. All in all a stress free journey which was comfortable.",0.065,0.774,0.161,0.9547,positive,0.17839262187088276,0.5009222661396574,positive,0.005352469626814127,0.978997528553009,0.001023978111334145,0.012488938868045807,0.0015410371124744415,0.0005960696726106107,joy,positive
On a recent vacation from Sacramento to Paris some friends and I had a terrible experience with another airline and had some trepidation about our return flight from Paris to Sacramento. We did however choose British Airways for the return flight and none of us had flown with them before. I am happy to report that the experience was totally different. Our flight was delayed by an hour which did effect our layover and did rush us to our next flight but we had a cushion of 2 hours layover so we were ok. On the flight the seats were more comfortable more leg room less noisy better entertainment due to screens on seats in front of you and the access to the bathroom was much easier to navigate. We also had seats relatively together which the other airline refused to offer us even though we had made the reservation months in advance. Their screen was so far ahead I couldn't see it and it offered only one choice. The staff was very kind to hydrate us frequently and gave us plenty to eat and it was all very palatable. I will definitely recommend British Airways for International flights to my friends.,0.034,0.798,0.169,0.9879,positive,0.13180555555555556,0.44861111111111124,positive,0.007034251466393471,0.9528917074203491,0.0016293986700475216,0.03415315970778465,0.003570274682715535,0.0007212534546852112,joy,positive
"I booked my flights to the UK in May 2019 and had to cancel our trip to the UK on March 12, 2020 .. 4 days prior to leaving because a travel ban was going to start on March 16, 2020 and because I am older and have pre-existing health conditions, my doctor asked me to postpone our trip. The British Airways customer care associates I talked with were great and caring and they were able to issue us travel credit for tickets that were non-refundable. Now the problem is, I need to rebook and use the travel credit by May 2020 for travel to the UK by May 2021 or lose all the credit from our trip. How can I make travel arrangements by May 2020 with the coronavirus out of control throughout the world and travel bans in place? I understand BA has policies in place, but I cannot understand how you can expect someone to make travel arrangements while the world is dealing with COVID-19. I feel this timeline is unfair to any consumer who has trust with their preferred airline, my preferred airline is still British Airways. British Airways needs to reevaluate their policies during a world crisis....and make adjustments as needed to be fair to consumers who trust them. Whether a consumer has purchased refundable or non-refundable tickets should not matter, because forcing a consumer to rebook while a world pandemic is happening and not adjusting your policies to the situation can change your loyal customers, remember, there are many other airlines out there to choose from. The coronavirus is something that no one has any control of. I guess the bottom line is I think British Airways needs to put some common sense to their policy. I want to rebook and travel, but I am hesitant to this at this time. Hopefully, May 2020 this pandemic is over for all of us. ",0.056,0.849,0.095,0.9397,positive,0.14821428571428572,0.41547619047619044,positive,0.03186728060245514,0.0010528750717639923,0.0007880362099967897,0.964957058429718,0.000943514343816787,0.000391283625504002,anger,negative
"Refusing to pay £73 pp to reserve seats in Business Class (a stunt more worthy of Ryanair) I checked in two passengers online 20 minutes after online check in opened only to find that one seat was in row 7 and the other in row 11. There was no option to change seats and no phone contact given. I tried to phone the British Airways Kuala Lumpur office but the number given would not connect. I then went to the BA Office listed in Kuala Lumpur only to find it had been closed and moved to another location in Ampang Park. Still having asked several people no one knew of a BA office. Arriving at the airport I was told the flight was full but a change of seats might be possible once on board, which proved to be the case. But I then found myself next to a family with three very small children. Although the parents did what they could to amuse the children it was always going to difficult during a 13 hour flight. It was a long night and a very difficult flight. The sight of young children in nappies wandering around is not what I expected in business class. All in all it was a flight in flying nursery which I would rather forget. I now know why other reviewers on this site have used the acronym BA - Better Avoid. Business class beware.",0.082,0.876,0.042,-0.8016,negative,-0.01008771929824562,0.5326315789473685,neutral,0.039543382823467255,0.046363797038793564,0.0019589257426559925,0.7501811385154724,0.16042964160442352,0.0015231408178806305,anger,negative
Original flight was cancelled with no explanation. There was no representative to help in rebooking We had to call customer service (long distance call) The line kept dropping Had to do 40 + calls to find new booking only to discover the only way I could fly the next day was by paying business class. No help with hotel for the night stay.,0.123,0.807,0.071,-0.3935,negative,0.1801948051948052,0.6435064935064936,positive,0.16695906221866608,0.06451325863599777,0.0017627064371481538,0.7355300188064575,0.029791664332151413,0.001443256507627666,anger,negative
After my flight to Vienna with BA I was hoping for a slight improvement on the way back - however the service was very boring. Drink service was rushed with the stewardess pouring an entire miniature of vodka into a drink before putting a drop of Tomato juice in when I asked for a Tomato and Vodka - unpalatable. Was glad to be off the plane in all fairness. Hoping that one day BA will wow me.,0.052,0.78,0.168,0.8863,positive,-0.09444444444444446,0.6319444444444445,negative,0.10209429264068604,0.11869270354509354,0.002401514444500208,0.7699723839759827,0.0038245366886258125,0.0030146280769258738,anger,negative
"London to Chicago. Could it get any worse? The flight to Chicago was equipped with the usual ancient Boeing 747-400. The British Airways First Class product doesn't come up to modern Business Class standards. This particular flight was late again, and the food / wine was simply awful. There is nothing remotely elegant about BA First Class, and the crew demonstrate no sophistication. This experience was like dining at your worst restaurant chain. Finally, not only is the aircraft tired and worn out, but the in flight so-called entertainment system did not work, and had to be rebooted twice. The First Class seat is a bad joke, and extraordinarily uncomfortable. British Airways are at least twenty years out of date with their entire First Class product. All that can be said about this airline is woeful. The Concorde First Class lounge at Heathrow is filthy dirty, and desperately needs refurbishment.",0.186,0.767,0.047,-0.9703,negative,-0.1972222222222222,0.5809027777777779,negative,0.8535166382789612,0.015482302755117416,0.0011602838058024645,0.12238135188817978,0.005800080485641956,0.001659297849982977,sadness,negative
"London Heathrow to Mumbai. I've been a loyal BA customer for several years, but this was a journey of disappointment. I was late to the airport due to delays on the train line. Called customer services while on my way, and after 15min of wait I was told they couldn't do anything about it, but gave me the number of the airport. It was incorrect. At Terminal 5 I asked the attendant for help given the rush. He was quite rude and said I had to join the queue unless I was flying business. At the gate, we had a late boarding because 'the computer wasn't working'. I was flying premium economy and let me say, on this flight (BA0199) it is like the economy class of several other airlines.  Plus this 777 was in desperate need of a refurbishment. My headrest was hanging down the seat, the screen was filthy and its arm broken so it wouldn't stay in position. The flight attendant (who I never saw smiling for the entire flight) said he had reported it on the way in. I asked to change my seat. In my new seat the headphone audio had regular loud cracks and pops (it wasn't the headphones, I tried mine too). The entertainment system was poor. It started nearly an hour into the flight and stopped an hour before landing, plus the 'noise cancelling' headphones are NOT noise cancelling - try pulling the jack out and it doesn't make a difference. Overall a very poor experience, crowned by a terrible breakfast. Sorry BA but you are stuck in the 80s and you're slipping further down my list of preferences.
",0.128,0.813,0.059,-0.9748,negative,-0.18969336219336216,0.49634213009213013,negative,0.13096536695957184,0.0015438010450452566,0.0017292068805545568,0.8634688258171082,0.0018978604348376393,0.0003949095553252846,anger,negative
"Food on this 4+ hours flight from Moscow to Heathrow was a filled roll and 1 cup of tea/coffee. The other London-Moscow flights provide a full meal. The cabin staff were almost robotic and programmed in the discharge of their duties with no interaction with passengers. When the flight touched down, it was 75 minutes before we disembarked, 6 British Airways flights that landed after us discharged their passengers whilst our flight waited first at a stand and then 15 minutes for an air bridge operator. My email to their CEO produced nothing except a plastic apology, even though the captain continually said we were waiting on find the guy responsible for stand allocation. Used to be BA was a world leader. They've followed the empire and dinosaurs into extinction.",0.017,0.957,0.026,0.0772,positive,0.10243055555555555,0.39965277777777775,positive,0.010244546458125114,0.05272570624947548,0.0014572173822671175,0.8818815350532532,0.05137964338064194,0.0023113160859793425,anger,negative
"Lima to Gatwick. Helpful and courteous cabin crew.  The seat was uncomfortable and the in flight entertainment system derisory. The screen was small and in poor condition. Movies shown in the in flight magazine were unavailable and the selection of movies was poor. The touch screen failed to respond correctly and at times occasionally, without warning, increased the sound level to maximum without touching the screen or handset. A 12 hr flight with a rubbish entertainment system.",0.145,0.712,0.143,-0.0497,neutral,-0.061111111111111144,0.5472222222222223,negative,0.19248546659946442,0.005571817979216576,0.0015049369540065527,0.0846848413348198,0.7136945128440857,0.0020584070589393377,fear,negative
"London to Seville. Following on from mistakenly booking a return flight with BA despite having a previous confirmed booking with a competitor, I quickly called up BA to resolve the issue. They understood the problem and gave me a full refund. The agent was exceptionally helpful on the phone and provided me a quick answer and solution to the problem. I don’t believe most airlines would have accepted my reasoning, however it’s great to see BA treat their customers with care.",0.077,0.719,0.204,0.9099,positive,0.3574074074074074,0.5629629629629629,positive,0.00029195359093137085,0.9963782429695129,0.002417976502329111,0.00034748914185911417,0.0001556503848405555,0.00040860637091100216,joy,positive
"No, no, no, British Airways. You've messed up. Someone sat in an office thought it would be a good idea to charge for food and drink on flights, just like many other airlines do, and they said ""Let's provide food from M&S: that will make our offering classier than the rest."" The problem on my 18:55 flight from Marrakech to London was that — it being dinner time — loads of passengers wanted food and drink, so the service was inevitably snail-paced. A piece of friendly advice, BA, you need to provide 4 cabin crew to handle economy on a dinnertime flight, or you merely annoy your customers. Sitting near the back of the plane, my wife and I got served 2 hours into the 3.5 hour flight, by which time our tongues were hanging out. But what's this? Only two sandwiches left, and we bagged the last two packets of crisps. You're promising things you can't deliver, BA. There is such as thing as advertising standards, and your beautifully photographed food and drinks menu drives a coach and horses through the principles of advertising standards. The 2 cabin crew serving economy soldiered on with their service most impressively, even managing to smile as for the umpteenth time someone's payment card failed to register on their machine. (Hint for frequent flyers: if your card just doesn't work you get your food and drink for free.) Meanwhile, behind the service trolley, a phalanx of passengers with their legs tightly crossed tried to avoid exhorting the cabin crew to move their trolley so they could access the toilets to relieve themselves (a very appropriate expression in the circumstances). Other passengers simply wanted to relieve themselves of the packaging of the food they bought hours earlier: several of them eventually came down the aisle waving their empty bottles and M&S extensive food packaging for the crew to remove from their sight. Whoever at British Airways is employed to read reviews on this website, please take note and pass it on to your management if you dare. The process I call 'Ryanisation' of British Airways is almost complete. You now charge for checked baggage (yes, I know that's indirect, but only idiots can't see through the scam), you exert an extortionate price for those unfortunate enough to be tall, and who need the legroom of emergency exit seats, and now you've devised a marvellous system of charged cabin service for food and drink on 'short haul' (what even BA used to call 'medium haul') flights that annoys more than half the customers on board the plane. Oh, and by the way: why don't the cabin crew deploy the A320 overhead monitors that display the flight progress? Too costly, perhaps? I suggest that BA needs to return to the days of advertising when you had a wonderful slogan, but with a minor revision: ""British Airways, the world's least favourite airline"".",0.064,0.846,0.09,0.9511,positive,0.07498236331569666,0.4488536155202823,positive,0.015668053179979324,0.6841691136360168,0.0033472790382802486,0.2852436304092407,0.009317995980381966,0.002253915648907423,joy,positive
"Heathrow to Barcelona. Reliable. No longer feels like travelling with a premium airline. Very functional, but unfortunately at a cost. Flight took off late, because luggage for a passenger needed to be off loaded, however arrived on time in Barcelona. Excellent information from the flight deck. Cabin crew robotic and lacked personality. Enough has already been said about charges for food and drink. Overall falling well below the standards of the competition. Great pity really.",0.127,0.71,0.162,0.7395,positive,0.12,0.475,positive,0.0006136683514341712,0.997826874256134,0.0003136390878353268,0.0005920492694713175,0.0003181009378749877,0.00033568276558071375,joy,positive
"London to Los Angeles. Booked this trip eight months previously and as I lost my status on BA a few years ago were forced to pay an additional £180 for our two seats. The flight I chose was a Boeing 787 and was prepared to part with the extra cash so we could be in the small front cabin. Never expecting anything to go according to plan with BA and our flight was cancelled a few days before. We were rebooked onto a later flight which they changed from an A380 to a twenty one year old Jumbo. We were then seated right at the back of Club World to benefit from a screaming child sat in the front row of premium. We were greeted by a rather pleasant steward who told us he would be looking after us for the trip, he then disappeared never to be seen again. Food was served within an hour of take off for an eleven hour flight. The steak so tough was it impossible to cut and could only be eaten by picking up and biting pieces off. After a few hours I went  to the galley to seek out a drink as the crew had disappeared, stood there being completely ignored by three stewardesses. Reluctantly one stopped chattering and managed to get me a drink. The second meal was served about seven hours after lunch, steak sandwich, at least that one was edible. The seat was as you would expect on such an old plane totally knackered, getting out was a task in itself. I bought WiFi for the whole trip, it ran for about 50% of the flight, yet their customer (non existent) services refuse to refund the payment even though I sent them a whole host of screenshots showing at various times there was no wifi service, but they are happy to note the problems. We have avoided BA now for some time, except where there is no other option as on Club Europe. But with transatlantic they are probably the bottom of the pile. We only took this trip to use up some Avios, they have all been used now and we could come back from LAX on Virgin Atlantic. Never again, BA club world offered is a farce in today's business market.",0.085,0.885,0.03,-0.9266,negative,-0.016919813902572512,0.41818555008210184,neutral,0.16367672383785248,0.014938036911189556,0.0013010847615078092,0.8083286285400391,0.011007157154381275,0.0007483931258320808,anger,negative
"London to Kuala Lumpur. This is my first time flying with BA to Kuala Lumpur on the Dreamliner 787. Was very excited for this trip as BA has made a come back to fly to Malaysia after stopping the service for many years. I paid to seat at the first row to have a longer leg room. I absolutely regretted and disappointed for the choice. I made a complaint to the crew that my seat (30B) has sunk and I felt uncomfortable to be sitting on this seat for the next 13 hours. Crew only offered me an extra pillow to seat on it, which didn't help either. The tv screen on 30B was also not working and I didn't watch anything during the whole duration of the flight. I would recommend to totally avoid sitting on all row 30 as the seats are so close to the lavatories that you can hear toilets flusing at all time. This will be my last time flying with BA unless the aircraft is changed to perhaps the A380. I am dreading on my next return flight back to London. Crews were friendly and helpful. No fault with that.",0.096,0.842,0.062,-0.7474,negative,0.07960526315789475,0.45833333333333326,positive,0.8122071623802185,0.01801292784512043,0.004878695122897625,0.1520317792892456,0.012254771776497364,0.000614664691966027,sadness,negative
"We are on our way home after a 3 week holiday in the UK and have had all 4 flights with British Airways. Our 2 internal flights between London and Edinburgh were great due to the friendly staff and there were no complications, however, the 2 long haul flights have been a nightmare. Our initial flight from Cape Town to Heathrow was a full flight, the staff seemed very overwhelmed, they ran out of certain food and drinks and as we were in economy right at the back we got the ""leftovers"", my entertainment system was also not working. We are about to board the return flight from Heathrow to Cape Town and the check in process was horrific. I had booked through Expedia and somehow my return flight did not have a checked in bag allowance which I didn't realise until we checked in. I ended up having to pay an additional £85 for my bag, after being told to try do it under manage my booking on the app which was not possible and I also spent 20 minutes on hold trying to get through to the BA customer service number with no luck. We asked to speak to someone is person in terminal 5 and were told that they have no customer service desk in the main BA terminal.  Overall it took us about 2 hours to get me checked in after speaking to about 6 different staff members, none of which could help me. There was also a discrepancy with the baggage allowance as my friend I am traveling with was allowed 26kg and after paying to add my bag I was told it was overweight as I was only allowed 23kg and the bag was 24kg. Compared to having flown with other airlines I will never fly with BA again, the level of service is shocking compared to what you would expect.",0.052,0.879,0.069,0.692,positive,-0.01856060606060607,0.4677489177489177,neutral,0.0035066907294094563,0.0056602247059345245,0.0013266645837575197,0.008450173772871494,0.5438359975814819,0.4372202157974243,fear,negative
